<?xml version="1.0" encoding="UTF-8"?>
<banksoal xmlns:xsi="http://www.w3.org/2001/XMLSchema-instance" xsi:noNamespaceSchemaLocation="quizweb.xsd"> 
	<soal>
		<mk>123</mk>
		<dosen>Beri</dosen>
		<tipe>ESSAY</tipe>
		<kode>PRAK/MK23/BB345</kode>			
	</soal>
	<soal>
		<mk>122</mk>
		<dosen>Susi</dosen>
		<tipe>PILGANDA</tipe>	
		<kode>TEO/MK33/AA123</kode>			
	</soal>
	
</banksoal>